CompanyKey,Ticker,CompanyName,Sector,Industry,Country,IPO_Year
1,A,Agilent Technologies Inc. Common Stock,Industrials,Biotechnology: Laboratory Analytical Instruments,United States,1999
2,AAL,American Airlines Group Inc. Common Stock,Consumer Discretionary,Air Freight/Delivery Services,United States,0
3,AAP,Advance Auto Parts Inc.,Consumer Discretionary,Auto & Home Supply Stores,United States,0
4,AAPL,Apple Inc. Common Stock,Technology,Computer Manufacturing,United States,1980
5,ABBV,AbbVie Inc. Common Stock,Health Care,Biotechnology: Pharmaceutical Preparations,United States,2012
6,ABT,Abbott Laboratories Common Stock,Health Care,Biotechnology: Pharmaceutical Preparations,United States,0
7,ACN,Accenture plc Class A Ordinary Shares (Ireland),Consumer Discretionary,Business Services,Ireland,2001
8,ADBE,Adobe Inc. Common Stock,Technology,Computer Software: Prepackaged Software,United States,1986
9,ADI,Analog Devices Inc. Common Stock,Technology,Semiconductors,United States,0
10,ADM,Archer-Daniels-Midland Company Common Stock,Consumer Staples,Packaged Foods,United States,0
11,ADP,Automatic Data Processing Inc. Common Stock,Technology,EDP Services,United States,0
12,ADSK,Autodesk Inc. Common Stock,Technology,Computer Software: Prepackaged Software,United States,0
13,AEE,Ameren Corporation Common Stock,Utilities,Power Generation,United States,0
14,AEP,American Electric Power Company Inc. Common Stock,Utilities,Electric Utilities: Central,United States,0
15,AES,The AES Corporation Common Stock,Utilities,Electric Utilities: Central,United States,0
16,AFL,AFLAC Incorporated Common Stock,Finance,Accident &Health Insurance,United States,0
17,AIG,American International Group Inc. New Common Stock,Finance,Life Insurance,United States,0
18,AIV,Apartment Investment and Management Company Common Stock,Real Estate,Real Estate Investment Trusts,United States,1994
19,AIZ,Assurant Inc. Common Stock,Finance,Property-Casualty Insurers,United States,2004
20,AJG,Arthur J. Gallagher & Co. Common Stock,Finance,Specialty Insurers,United States,0
21,AKAM,Akamai Technologies Inc. Common Stock,Consumer Discretionary,Business Services,United States,1999
22,ALB,Albemarle Corporation Common Stock,Industrials,Major Chemicals,United States,0
23,ALGN,Align Technology Inc. Common Stock,Health Care,Industrial Specialties,United States,2001
24,ALK,Alaska Air Group Inc. Common Stock,Consumer Discretionary,Air Freight/Delivery Services,United States,0
25,ALL,Allstate Corporation (The) Common Stock,Finance,Property-Casualty Insurers,United States,0
26,ALLE,Allegion plc Ordinary Shares,Consumer Discretionary,Diversified Commercial Services,United States,2013
27,AMAT,Applied Materials Inc. Common Stock,Technology,Semiconductors,United States,1972
28,AMD,Advanced Micro Devices Inc. Common Stock,Technology,Semiconductors,United States,0
29,AME,AMETEK Inc.,Industrials,Industrial Machinery/Components,United States,0
30,AMG,Affiliated Managers Group Inc. Common Stock,Finance,Investment Managers,United States,0
31,AMGN,Amgen Inc. Common Stock,Health Care,Biotechnology: Biological Products (No Diagnostic Substances),United States,1983
32,AMP,Ameriprise Financial Inc. Common Stock,Finance,Investment Managers,United States,0
33,AMT,American Tower Corporation (REIT) Common Stock,Real Estate,Real Estate Investment Trusts,United States,0
34,AMZN,Amazon.com Inc. Common Stock,Consumer Discretionary,Catalog/Specialty Distribution,United States,1997
35,ANSS,ANSYS Inc. Common Stock,Technology,Computer Software: Prepackaged Software,United States,1996
36,AON,Aon plc Class A Ordinary Shares (Ireland),Finance,Specialty Insurers,United States,0
37,AOS,A.O. Smith Corporation Common Stock,Consumer Discretionary,Consumer Electronics/Appliances,United States,0
38,APA,APA Corporation Common Stock,Energy,Oil & Gas Production,United States,0
39,APD,Air Products and Chemicals Inc. Common Stock,Industrials,Major Chemicals,United States,0
40,APH,Amphenol Corporation Common Stock,Technology,Electrical Products,United States,0
41,APTV,Aptiv PLC Ordinary Shares,Consumer Discretionary,Auto Parts:O.E.M.,United Kingdom,0
42,ARE,Alexandria Real Estate Equities Inc. Common Stock,Real Estate,Real Estate Investment Trusts,United States,0
43,AVB,AvalonBay Communities Inc. Common Stock,Real Estate,Real Estate Investment Trusts,United States,0
44,AVGO,Broadcom Inc. Common Stock,Technology,Semiconductors,United States,2009
45,AVY,Avery Dennison Corporation Common Stock,Consumer Discretionary,Containers/Packaging,United States,0
46,AWK,American Water Works Company Inc. Common Stock,Utilities,Water Supply,United States,2008
47,AXP,American Express Company Common Stock,Finance,Finance: Consumer Services,United States,0
48,AYI,Acuity Brands Inc. ,Consumer Discretionary,Building Products,United States,0
49,AZO,AutoZone Inc. Common Stock,Consumer Discretionary,Auto & Home Supply Stores,United States,0
50,BA,Boeing Company (The) Common Stock,Industrials,Aerospace,United States,0
51,BAC,Bank of America Corporation Common Stock,Finance,Major Banks,United States,0
52,BAX,Baxter International Inc. Common Stock,Health Care,Medical/Dental Instruments,United States,0
53,BBY,Best Buy Co. Inc. Common Stock,Consumer Discretionary,Consumer Electronics/Video Chains,United States,0
54,BDX,Becton Dickinson and Company Common Stock,Health Care,Medical/Dental Instruments,United States,0
55,BEN,Franklin Resources Inc. Common Stock,Finance,Investment Managers,United States,0
56,BHF,Brighthouse Financial Inc. Common Stock,Finance,Life Insurance,United States,0
57,BIIB,Biogen Inc. Common Stock,Health Care,Biotechnology: Biological Products (No Diagnostic Substances),United States,0
58,BK,The Bank of New York Mellon Corporation Common Stock,Finance,Major Banks,United States,0
59,BLK,BlackRock Inc. Common Stock,Finance,Investment Bankers/Brokers/Service,United States,1999
60,BMY,Bristol-Myers Squibb Company Common Stock,Health Care,Biotechnology: Pharmaceutical Preparations,United States,0
61,BSX,Boston Scientific Corporation Common Stock,Health Care,Medical/Dental Instruments,United States,0
62,BWA,BorgWarner Inc. Common Stock,Consumer Discretionary,Auto Parts:O.E.M.,United States,0
63,BXP,BXP Inc. Common Stock,Real Estate,Real Estate Investment Trusts,United States,1997
64,C,Citigroup Inc. Common Stock,Finance,Major Banks,United States,0
65,CAG,ConAgra Brands Inc. Common Stock,Consumer Staples,Packaged Foods,United States,0
66,CAH,Cardinal Health Inc. Common Stock,Health Care,Other Pharmaceuticals,United States,0
67,CAT,Caterpillar Inc. Common Stock,Industrials,Construction/Ag Equipment/Trucks,United States,0
68,CB,Chubb Limited  Common Stock,Finance,Property-Casualty Insurers,Switzerland,0
69,CBOE,Cboe Global Markets Inc. Common Stock,Finance,Investment Bankers/Brokers/Service,Unknown,2010
70,CCI,Crown Castle Inc. Common Stock,Real Estate,Real Estate Investment Trusts,United States,0
71,CCL,Carnival Corporation Common Stock,Consumer Discretionary,Marine Transportation,United States,1987
72,CDNS,Cadence Design Systems Inc. Common Stock,Technology,Computer Software: Prepackaged Software,United States,0
73,CF,CF Industries Holdings Inc. Common Stock,Industrials,Agricultural Chemicals,United States,2005
74,CFG,Citizens Financial Group Inc. Common Stock,Finance,Major Banks,United States,2014
75,CHD,Church & Dwight Company Inc. Common Stock,Consumer Discretionary,Package Goods/Cosmetics,United States,0
76,CHRW,C.H. Robinson Worldwide Inc. Common Stock,Consumer Discretionary,Oil Refining/Marketing,United States,1997
77,CHTR,Charter Communications Inc. Class A Common Stock New,Telecommunications,Cable & Other Pay Television Services,United States,0
78,CI,The Cigna Group Common Stock,Health Care,Medical Specialities,United States,0
79,CINF,Cincinnati Financial Corporation Common Stock,Finance,Property-Casualty Insurers,United States,0
80,CL,Colgate-Palmolive Company Common Stock,Consumer Discretionary,Package Goods/Cosmetics,United States,0
81,CLX,Clorox Company (The) Common Stock,Consumer Discretionary,Specialty Chemicals,United States,0
82,CMA,Comerica Incorporated Common Stock,Finance,Major Banks,United States,0
83,CMCSA,Comcast Corporation Class A Common Stock,Telecommunications,Cable & Other Pay Television Services,United States,0
84,CME,CME Group Inc. Class A Common Stock,Finance,Investment Bankers/Brokers/Service,United States,2002
85,CMG,Chipotle Mexican Grill Inc. Common Stock,Consumer Discretionary,Restaurants,United States,2006
86,CMI,Cummins Inc. Common Stock,Industrials,Industrial Machinery/Components,United States,0
87,CMS,CMS Energy Corporation Common Stock,Utilities,Power Generation,United States,0
88,CNC,Centene Corporation Common Stock,Health Care,Medical Specialities,United States,0
89,CNP,CenterPoint Energy Inc (Holding Co) Common Stock,Utilities,Electric Utilities: Central,United States,0
90,COF,Capital One Financial Corporation Common Stock,Finance,Major Banks,United States,1994
91,COO,The Cooper Companies Inc. Common Stock,Health Care,Ophthalmic Goods,United States,0
92,COP,ConocoPhillips Common Stock,Energy,Integrated oil Companies,United States,0
93,COST,Costco Wholesale Corporation Common Stock,Consumer Discretionary,Department/Specialty Retail Stores,United States,0
94,COTY,Coty Inc. Class A Common Stock,Consumer Discretionary,Package Goods/Cosmetics,United States,2013
95,CPB,The Campbell's Company Common Stock,Consumer Staples,Packaged Foods,United States,0
96,CRM,Salesforce Inc. Common Stock,Technology,Computer Software: Prepackaged Software,United States,2004
97,CSCO,Cisco Systems Inc. Common Stock (DE),Telecommunications,Computer Communications Equipment,United States,1990
98,CSX,CSX Corporation Common Stock,Industrials,Railroads,United States,0
99,CTAS,Cintas Corporation Common Stock,Consumer Discretionary,Apparel,United States,1983
100,CTSH,Cognizant Technology Solutions Corporation Class A Common Stock,Technology,EDP Services,United States,1998
101,CVS,CVS Health Corporation Common Stock,Consumer Staples,Retail-Drug Stores and Proprietary Stores,United States,0
102,CVX,Chevron Corporation Common Stock,Energy,Integrated oil Companies,United States,0
103,D,Dominion Energy Inc. Common Stock,Utilities,Electric Utilities: Central,United States,0
104,DAL,Delta Air Lines Inc. Common Stock,Consumer Discretionary,Air Freight/Delivery Services,United States,0
105,DE,Deere & Company Common Stock,Industrials,Industrial Machinery/Components,United States,0
106,DFS,Discover Financial Services Common Stock,Finance,Finance: Consumer Services,United States,0
107,DG,Dollar General Corporation Common Stock,Consumer Discretionary,Department/Specialty Retail Stores,United States,2009
108,DGX,Quest Diagnostics Incorporated Common Stock,Health Care,Medical Specialities,United States,0
109,DHI,D.R. Horton Inc. Common Stock,Consumer Discretionary,Homebuilding,United States,0
110,DHR,Danaher Corporation Common Stock,Industrials,Industrial Machinery/Components,United States,0
111,DIS,Walt Disney Company (The) Common Stock,Consumer Discretionary,Services-Misc. Amusement & Recreation,United States,0
112,DLR,Digital Realty Trust Inc. Common Stock,Real Estate,Real Estate Investment Trusts,United States,2004
113,DLTR,Dollar Tree Inc. Common Stock,Consumer Discretionary,Department/Specialty Retail Stores,United States,1995
114,DOV,Dover Corporation Common Stock,Industrials,Industrial Machinery/Components,United States,0
115,DRI,Darden Restaurants Inc. Common Stock,Consumer Discretionary,Restaurants,United States,0
116,DTE,DTE Energy Company Common Stock,Utilities,Electric Utilities: Central,United States,0
117,DUK,Duke Energy Corporation (Holding Company) Common Stock,Utilities,Power Generation,United States,0
118,DVA,DaVita Inc. Common Stock,Health Care,Misc Health and Biotechnology Services,United States,0
119,DVN,Devon Energy Corporation Common Stock,Energy,Oil & Gas Production,United States,1985
120,DXC,DXC Technology Company Common Stock ,Technology,EDP Services,United States,0
121,EA,Electronic Arts Inc. Common Stock,Technology,Computer Software: Prepackaged Software,United States,0
122,EBAY,eBay Inc. Common Stock,Consumer Discretionary,Business Services,United States,1998
123,ECL,Ecolab Inc. Common Stock,Consumer Discretionary,Package Goods/Cosmetics,United States,0
124,ED,Consolidated Edison Inc. Common Stock,Utilities,Power Generation,United States,0
125,EFX,Equifax Inc. Common Stock,Finance,Finance: Consumer Services,United States,0
126,EIX,Edison International Common Stock,Utilities,Electric Utilities: Central,United States,0
127,EL,Estee Lauder Companies Inc. (The) Common Stock,Consumer Discretionary,Package Goods/Cosmetics,United States,1995
128,EMN,Eastman Chemical Company Common Stock,Industrials,Major Chemicals,United States,0
129,EMR,Emerson Electric Company Common Stock,Technology,Consumer Electronics/Appliances,United States,0
130,EOG,EOG Resources Inc. Common Stock,Energy,Oil & Gas Production,United States,0
131,EQIX,Equinix Inc. Common Stock REIT,Real Estate,Real Estate Investment Trusts,United States,2000
132,EQR,Equity Residential Common Shares of Beneficial Interest,Real Estate,Real Estate Investment Trusts,United States,0
133,EQT,EQT Corporation Common Stock,Energy,Oil & Gas Production,United States,0
134,ES,Eversource Energy (D/B/A) Common Stock,Utilities,Electric Utilities: Central,United States,0
135,ESS,Essex Property Trust Inc. Common Stock,Real Estate,Real Estate Investment Trusts,United States,1994
136,ETN,Eaton Corporation PLC Ordinary Shares,Technology,Industrial Machinery/Components,Ireland,0
137,ETR,Entergy Corporation Common Stock,Utilities,Electric Utilities: Central,United States,0
138,EW,Edwards Lifesciences Corporation Common Stock,Health Care,Industrial Specialties,United States,0
139,EXC,Exelon Corporation Common Stock,Utilities,Power Generation,United States,0
140,EXPD,Expeditors International of Washington Inc. Common Stock,Consumer Discretionary,Oil Refining/Marketing,United States,0
141,EXPE,Expedia Group Inc. Common Stock,Consumer Discretionary,Transportation Services,United States,0
142,EXR,Extra Space Storage Inc Common Stock,Real Estate,Real Estate Investment Trusts,United States,2004
143,F,Ford Motor Company Common Stock,Consumer Discretionary,Auto Manufacturing,United States,0
144,FAST,Fastenal Company Common Stock,Consumer Discretionary,RETAIL: Building Materials,United States,1987
145,FCX,Freeport-McMoRan Inc. Common Stock,Basic Materials,Metal Mining,United States,0
146,FDX,FedEx Corporation Common Stock,Consumer Discretionary,Air Freight/Delivery Services,United States,0
147,FE,FirstEnergy Corp. Common Stock,Utilities,Electric Utilities: Central,United States,0
148,FFIV,F5 Inc. Common Stock,Telecommunications,Computer Communications Equipment,United States,1999
149,FIS,Fidelity National Information Services Inc. Common Stock,Consumer Discretionary,Business Services,United States,0
150,FITB,Fifth Third Bancorp Common Stock,Finance,Major Banks,United States,0
151,FL,Foot Locker Inc.,Consumer Discretionary,Clothing/Shoe/Accessory Stores,United States,0
152,FLR,Fluor Corporation Common Stock,Industrials,Military/Government/Technical,United States,0
153,FLS,Flowserve Corporation Common Stock,Industrials,Fluid Controls,United States,0
154,FMC,FMC Corporation Common Stock,Industrials,Major Chemicals,United States,0
155,FOX,Fox Corporation Class B Common Stock,Industrials,Broadcasting,United States,0
156,FOXA,Fox Corporation Class A Common Stock,Industrials,Broadcasting,United States,0
157,FRT,Federal Realty Investment Trust Common Stock,Real Estate,Real Estate Investment Trusts,United States,0
158,FTI,TechnipFMC plc Ordinary Share,Industrials,Metal Fabrications,Unknown,0
159,FTV,Fortive Corporation Common Stock ,Industrials,Industrial Machinery/Components,United States,2016
160,GD,General Dynamics Corporation Common Stock,Industrials,Marine Transportation,United States,0
161,GE,GE Aerospace Common Stock,Technology,Consumer Electronics/Appliances,United States,0
162,GILD,Gilead Sciences Inc. Common Stock,Health Care,Biotechnology: Biological Products (No Diagnostic Substances),United States,1992
163,GIS,General Mills Inc. Common Stock,Consumer Staples,Packaged Foods,United States,0
164,GLW,Corning Incorporated Common Stock,Industrials,Telecommunications Equipment,United States,0
165,GM,General Motors Company Common Stock,Consumer Discretionary,Auto Manufacturing,United States,2010
166,GOOG,Alphabet Inc. Class C Capital Stock,Technology,Computer Software: Programming Data Processing,United States,2004
167,GOOGL,Alphabet Inc. Class A Common Stock,Technology,Computer Software: Programming Data Processing,United States,2004
168,GPC,Genuine Parts Company Common Stock,Consumer Discretionary,Automotive Aftermarket,United States,0
169,GPN,Global Payments Inc. Common Stock,Consumer Discretionary,Business Services,United States,0
170,GRMN,Garmin Ltd. Common Stock (Switzerland),Industrials,Industrial Machinery/Components,Switzerland,2000
171,GS,Goldman Sachs Group Inc. (The) Common Stock,Finance,Investment Bankers/Brokers/Service,United States,1999
172,GT,The Goodyear Tire & Rubber Company Common Stock,Consumer Discretionary,Automotive Aftermarket,United States,0
173,GWW,W.W. Grainger Inc. Common Stock,Industrials,Office Equipment/Supplies/Services,United States,0
174,HAL,Halliburton Company Common Stock,Energy,Oilfield Services/Equipment,United States,0
175,HAS,Hasbro Inc. Common Stock,Consumer Discretionary,Recreational Games/Products/Toys,United States,0
176,HBAN,Huntington Bancshares Incorporated Common Stock,Finance,Major Banks,United States,0
177,HBI,Hanesbrands Inc. Common Stock,Consumer Discretionary,Clothing/Shoe/Accessory Stores,United States,0
178,HCA,HCA Healthcare Inc. Common Stock,Health Care,Hospital/Nursing Management,United States,2011
179,HD,Home Depot Inc. (The) Common Stock,Consumer Discretionary,RETAIL: Building Materials,United States,0
180,HES,Hess Corporation Common Stock,Energy,Integrated oil Companies,United States,0
181,HIG,The Hartford Insurance Group Inc. Common Stock,Finance,Property-Casualty Insurers,United States,0
182,HII,Huntington Ingalls Industries Inc. Common Stock,Industrials,Marine Transportation,United States,0
183,HLT,Hilton Worldwide Holdings Inc. Common Stock ,Consumer Discretionary,Hotels/Resorts,United States,2016
184,HOG,Harley-Davidson Inc. Common Stock,Consumer Discretionary,Motor Vehicles,United States,0
185,HOLX,Hologic Inc. Common Stock,Health Care,Medical Electronics,United States,1990
186,HON,Honeywell International Inc. Common Stock,Industrials,Aerospace,United States,0
187,HP,Helmerich & Payne Inc. Common Stock,Energy,Oil & Gas Production,United States,0
188,HPE,Hewlett Packard Enterprise Company Common Stock,Technology,Retail: Computer Software & Peripheral Equipment,United States,2015
189,HPQ,HP Inc. Common Stock,Technology,Computer Manufacturing,United States,0
190,HRB,H&R Block Inc. Common Stock,Consumer Discretionary,Other Consumer Services,United States,0
191,HRL,Hormel Foods Corporation Common Stock,Consumer Staples,Meat/Poultry/Fish,United States,0
192,HSIC,Henry Schein Inc. Common Stock,Health Care,Medical Specialities,United States,1995
193,HST,Host Hotels & Resorts Inc. Common Stock,Real Estate,Real Estate Investment Trusts,United States,0
194,HSY,The Hershey Company Common Stock,Consumer Staples,Specialty Foods,United States,0
195,HUM,Humana Inc. Common Stock,Health Care,Medical Specialities,United States,0
196,IBM,International Business Machines Corporation Common Stock,Technology,Computer Manufacturing,United States,0
197,ICE,Intercontinental Exchange Inc. Common Stock,Finance,Investment Bankers/Brokers/Service,United States,2005
198,IDXX,IDEXX Laboratories Inc. Common Stock,Health Care,Biotechnology: In Vitro & In Vivo Diagnostic Substances,United States,1991
199,IFF,International Flavors & Fragrances Inc. Common Stock,Industrials,Major Chemicals,United States,0
200,ILMN,Illumina Inc. Common Stock,Health Care,Medical Specialities,United States,2000
201,INCY,Incyte Corp. Common Stock,Health Care,Biotechnology: Commercial Physical & Biological Resarch,United States,0
202,INTC,Intel Corporation Common Stock,Technology,Semiconductors,United States,0
203,INTU,Intuit Inc. Common Stock,Technology,Computer Software: Prepackaged Software,United States,1993
204,IP,International Paper Company Common Stock,Basic Materials,Paper,United States,0
205,IPG,Interpublic Group of Companies Inc. (The) Common Stock,Consumer Discretionary,Advertising,United States,0
206,IQV,IQVIA Holdings Inc. Common Stock,Health Care,Biotechnology: Commercial Physical & Biological Resarch,United States,2013
207,IR,Ingersoll Rand Inc. Common Stock,Industrials,Industrial Machinery/Components,United States,2017
208,IRM,Iron Mountain Incorporated (Delaware)Common Stock REIT,Real Estate,Real Estate Investment Trusts,United States,0
209,ISRG,Intuitive Surgical Inc. Common Stock,Health Care,Industrial Specialties,United States,2000
210,IT,Gartner Inc. Common Stock,Consumer Discretionary,Other Consumer Services,United States,1993
211,ITW,Illinois Tool Works Inc. Common Stock,Industrials,Industrial Machinery/Components,United States,0
212,IVZ,Invesco Ltd Common Stock,Finance,Investment Managers,United States,0
213,JBHT,J.B. Hunt Transport Services Inc. Common Stock,Industrials,Trucking Freight/Courier Services,United States,0
214,JCI,Johnson Controls International plc Ordinary Share,Industrials,Industrial Machinery/Components,Switzerland,0
215,JNJ,Johnson & Johnson Common Stock,Health Care,Biotechnology: Pharmaceutical Preparations,United States,0
216,JNPR,Juniper Networks Inc. Common Stock,Telecommunications,Computer Communications Equipment,United States,1999
217,JPM,JP Morgan Chase & Co. Common Stock,Finance,Major Banks,United States,0
218,JWN,Nordstrom Inc. Common Stock,Consumer Discretionary,Clothing/Shoe/Accessory Stores,United States,0
219,K,Kellanova Common Stock,Consumer Staples,Packaged Foods,United States,0
220,KEY,KeyCorp Common Stock,Finance,Major Banks,United States,0
221,KHC,The Kraft Heinz Company Common Stock,Consumer Staples,Packaged Foods,United States,0
222,KIM,Kimco Realty Corporation (HC) Common Stock,Real Estate,Real Estate Investment Trusts,United States,0
223,KLAC,KLA Corporation Common Stock,Technology,Electronic Components,United States,1980
224,KMB,Kimberly-Clark Corporation Common Stock,Consumer Discretionary,Containers/Packaging,United States,0
225,KMI,Kinder Morgan Inc. Common Stock,Utilities,Natural Gas Distribution,United States,2011
226,KMX,CarMax Inc,Consumer Discretionary,Retail-Auto Dealers and Gas Stations,United States,0
227,KO,Coca-Cola Company (The) Common Stock,Consumer Staples,Beverages (Production/Distribution),United States,0
228,KR,Kroger Company (The) Common Stock,Consumer Staples,Food Chains,United States,0
229,KSS,Kohl's Corporation Common Stock,Consumer Discretionary,Department/Specialty Retail Stores,United States,1992
230,L,Loews Corporation Common Stock,Finance,Property-Casualty Insurers,United States,0
231,LB,LandBridge Company LLC Class A Shares Representing Limited Liability Company Interests,Energy,Oil & Gas Production,Unknown,2024
232,LEG,Leggett & Platt Incorporated Common Stock,Consumer Discretionary,Home Furnishings,United States,0
233,LEN,Lennar Corporation Class A Common Stock,Consumer Discretionary,Homebuilding,United States,0
234,LH,Labcorp Holdings Inc. Common Stock,Health Care,Medical Specialities,United States,0
235,LKQ,LKQ Corporation Common Stock,Consumer Discretionary,Motor Vehicles,United States,2003
236,LLY,Eli Lilly and Company Common Stock,Health Care,Biotechnology: Pharmaceutical Preparations,United States,0
237,LMT,Lockheed Martin Corporation Common Stock,Industrials,Military/Government/Technical,United States,0
238,LNC,Lincoln National Corporation Common Stock,Finance,Life Insurance,United States,0
239,LNT,Alliant Energy Corporation Common Stock,Utilities,Power Generation,United States,0
240,LOW,Lowe's Companies Inc. Common Stock,Consumer Discretionary,RETAIL: Building Materials,United States,0
241,LRCX,Lam Research Corporation Common Stock,Technology,Industrial Machinery/Components,United States,1984
242,LUV,Southwest Airlines Company Common Stock,Consumer Discretionary,Air Freight/Delivery Services,United States,0
243,LYB,LyondellBasell Industries NV Ordinary Shares Class A (Netherlands),Industrials,Major Chemicals,Netherlands,0
244,M,Macy's Inc Common Stock,Consumer Discretionary,Department/Specialty Retail Stores,United States,0
245,MA,Mastercard Incorporated Common Stock,Consumer Discretionary,Business Services,United States,2006
246,MAA,Mid-America Apartment Communities Inc. Common Stock,Real Estate,Real Estate Investment Trusts,United States,1994
247,MAC,Macerich Company (The) Common Stock,Real Estate,Real Estate Investment Trusts,United States,1994
248,MAR,Marriott International Class A Common Stock,Consumer Discretionary,Hotels/Resorts,United States,0
249,MAS,Masco Corporation Common Stock,Industrials,Industrial Specialties,United States,0
250,MAT,Mattel Inc. Common Stock,Consumer Discretionary,Recreational Games/Products/Toys,United States,0
251,MCD,McDonald's Corporation Common Stock,Consumer Discretionary,Restaurants,United States,0
252,MCHP,Microchip Technology Incorporated Common Stock,Technology,Semiconductors,United States,1993
253,MCK,McKesson Corporation Common Stock,Health Care,Other Pharmaceuticals,United States,0
254,MCO,Moody's Corporation Common Stock,Finance,Finance: Consumer Services,United States,0
255,MDLZ,Mondelez International Inc. Class A Common Stock,Consumer Staples,Packaged Foods,United States,0
